Place_Name,Description,Categories,City,Price,Ratings,Time_Minutes,Coordinate,Lat,Long,_1,Rating_Count,Categories_Label
Pantai Samas,"Samas Beach (Javanese: ê¦¥ê¦±ê¦¶ê¦±ê¦¶ê¦‚â€‹ê¦±ê¦©ê¦±ê§€, translit. Pasisir Samas) is one of the beaches that is on a row of beaches east of Parangtritis Beach. The location of Samas Beach is approximately 14 km south of Bantul City or around 35 km from the center of Yogyakarta City, precisely in Srigading Village, Sanden District, Bantul Regency, Yogyakarta Special Region.",Nautical,Yogyakarta,4000,4,45.0,"{'lat': -8.0045535, 'lng': 110.2703756}",-80045535,1102703756,190,25,2
Pantai Kesirat,"In general, beaches are synonymous with sand, aren't they, but Kesirat beach has its own uniqueness that you will find here. Kesirat beach does not have sand, but you will find cliffs that have a beautiful structure, then you can enjoy the beach on it, this place is also very suitable for enjoying the sunset. The beauty of this beach makes everyone unable to forget it, just like their ex promised hehee... Kesirat beach has really instagrammable photo spots, perfect for those of you who like taking photos. Another unique thing that is characteristic of Kesirat Beach tourism is the presence of a tree that appears to be standing firmly which is the icon of this tourist spot. Many tourists use this tree as a background for their photos.",Nautical,Yogyakarta,5000,46,90.0,"{'lat': -8.096153500000002, 'lng': 110.4350483}",-80961535,1104350483,201,37,2
Wisata Kaliurang,"Jogja is always interesting to explore, especially its tourist attractions. Various tours are available in Jogja, ranging from artificial tourism to natural tourism. Like the Kaliurang Tourism Park, which combines natural elements with a recreational park. This recreation park is located on the slopes of Mount Merapi. It's not surprising that this tourist attraction is very cool. Spending time on holiday here is the right choice.",Nature preserve,Yogyakarta,8000,44,60.0,"{'lat': -7.6120675, 'lng': 110.4205209}",-76120675,1104205209,206,22,1
Taman Sungai Mudal,"Mudal River Park, an outdoor tourist attraction located in Kulon Progo Regency, which offers the charm of a bathing pool that originates from a natural spring. The spring comes from a cave, so the presence of the Mudal River Park eliminates the haunted impression of a cave. Moreover, it is coupled with the support of facilities that make tourists feel comfortable when they are there. Mudal River Park is one of the Kulon Progo tourist attractions which is always the main destination when the holidays arrive. One of the main reasons is because the Mudal River Park is able to become a fun family tourist destination.",Nature preserve,Yogyakarta,10000,46,150.0,"{'lat': -7.762813599999998, 'lng': 110.1161626}",-77628136,1101161626,208,33,1
Taman Hutan Raya Ir. H. Djuanda,"Grand Forest Park Ir. H. Djuanda (Tahura Djuanda) is an integrated conservation area between secondary nature and plantation forests of the Pine species (Pinus merkusil) located in the Cikapundung River Sub-Watershed and the Citarum Watershed which stretches from Curug Dago, Dago Pakar to Curug Maribaya which is part of the Mount Pulosari forest group.\nTahura Djuanda is located in the north of Bandung City, approximately 7 km from the city center, geographically located at 1070 30' East Longitude and 60 52' South Latitude, administratively located in the Ciburial Village area, Cimenyan District, Bandung Regency and parts of it include Mekarwangi Village, Cibodas Village, Langensari Village, and Wangunharja Village, Lembang District, West Bandung Regency and Dago Village, Coblong District, Bandung City.\nBased on the reconstruction of the boundaries of Tahura Djuanda in 2003, the area is 526.98 ha.",Nature preserve,Bandung,15000,45,90.0,"{'lat': -6.8565791, 'lng': 107.6323734}",-68565791,1076323734,215,20,1
Kebun Binatang Bandung,"Bandung Zoo is one of the natural flora and fauna tourist attractions in Bandung City, West Java, Indonesia. Bandung Zoo is located adjacent to the Bandung Institute of Technology campus and the Cikapundung River.",Nature preserve,Bandung,20000,4,180.0,"{'lat': -6.8897177, 'lng': 107.6077282}",-68897177,1076077282,217,21,1
Museum Konferensi Asia Afrika,"The Asian-African Conference Museum is one of the museums in the city of Bandung, located on Jalan Asia Afrika No. 65. This museum is a memorabilia of the Asian-African Conference. This museum has a very close relationship with Gedung Merdeka. Overall, Gedung Merdeka has two main buildings, the first is called Gedung Merdeka as the main meeting place, while next to Gedung Merdeka is the Asian-African Conference Museum as a place for memorabilia of the Asian-African Conference. The background to the construction of this museum was the desire of the leaders of nations in Asia and Africa to know about the Merdeka Building and its surroundings where the Asian-African Conference took place. This made the Minister of Foreign Affairs of the Republic of Indonesia, Prof. Dr. Mochtar Kusumaatmadja, SH, LL.M had the idea to build a museum. He conveyed this idea at the meeting forum of the Committee to Commemorate the 25th Anniversary of the Asian-African Conference (1980) which was attended by the Director General of Culture, Prof. Dr. Haryati Soebadio as representative from the Ministry of Education and Culture. Then this museum was inaugurated on April 24 1980 to coincide with the 25th anniversary of the Asian-African Conference.",Culture,Bandung,0,46,60.0,"{'lat': -6.921109200000001, 'lng': 107.609597}",-69211092,107609597,222,18,0
Amazing Art World,"Amazing Art World Bandung, a tourist attraction located in Bandung, which emphasizes that tourist destinations are not just about beaches, waterfalls or other natural attractions. The resulting painting turns out to be a very pleasant tourist destination. Moreover, 3D paintings, apart from being cool, are capable of manipulating the eyes of visitors. The size of Amazing Art World Bandung makes it one of the largest 3D painting museums, not only at the national level, but in the world.",Culture,Bandung,75000,45,45.0,"{'lat': -6.8516591, 'lng': 107.5955534}",-68516591,1075955534,234,23,0
Gua Belanda,"Bandung Dutch Cave is a cave located in an area which is now designated as the Ir. Forest Park. H. Djuanda is a stretch of mountains from West to East which is a ""natural giant water tank"" for reserves in the dry season. In the Cikapundung River Basin area in the Ir. Forest Park. H. Djuanda, during the Dutch occupation, built the Bengkok Hydroelectric Power Plant (PLTA), which was the first hydroelectric power plant in Indonesia, in 1918, where the tunnel passed through tufaan sandstone hills.",Nature preserve,Bandung,15000,44,45.0,"{'lat': -6.8544594, 'lng': 107.6377907}",-68544594,1076377907,235,22,1
Lembang Park & Zoo,"At Lembang Park & Zoo there are 370 animals, including various types of herbivores, carnivores and omnivores. The total area of this place reaches 20 hectares, but only 10 hectares have been developed. The rest will be developed as safari concept tourism. In the safari area, visitors can go around using vehicles to see the animals that are freely released in the area.",Nature preserve,Bandung,50000,45,210.0,"{'lat': -6.8059154, 'lng': 107.5919726}",-68059154,1075919726,239,21,1
Curug Tilu Leuwi Opat,"Curug Tilu Leuwi Opat is one of the waterfall tourist attractions in Lembang. The place itself is quite spacious. Here there are outbound areas, camping, and of course waterfall and river tourism. The front area is a valley with a clear river. Usually outbound, camping and games are held in this area. The location of the Tilu Leuwi Opat waterfall is actually directly next door to Dusun Bambu, you know. Have you ever been to Bamboo Village? If you go up to the Lutung Kasarung skywalk, or visit the camping area, you can see the valley which directly borders the bamboo village. Well, the valley is included in the tourist area of Curug Tilu Leuwi Opat. In this valley flows a river with clear water which originates from Situ Lembang.",Nature preserve,Bandung,10000,44,120.0,"{'lat': -6.790569199999999, 'lng': 107.5826388}",-67905692,1075826388,246,26,1
Museum Barli,"The Barli Museum is a museum located in Bandung City. This museum is dedicated to remembering and exhibiting the work of painter Barli Sasmitawinata. This museum was founded in 1990 and inaugurated in October 1992 by Soesilo Soedarman, Minister of Tourism, Post and Telecommunications at that time. Initially this museum was not open to the public. However, currently the museum can be visited by anyone. This museum is also a place for various art activities such as fine art exhibitions, work sales, discussions and workshops, ceramic and painting studio training.",Culture,Bandung,15000,44,180.0,"{'lat': -6.878238699999999, 'lng': 107.5875349}",-68782387,1075875349,255,24,0
Monumen Perjuangan Rakyat Jawa Barat,"The West Java People's Struggle Monument (Monju) is the West Java People's Struggle History Museum, in Tatar Pasundan or Parahyangan. The monument was inaugurated by the Governor of West Java, Raden Nana Nuriana on August 23 1995.",Culture,Bandung,0,45,45.0,"{'lat': -6.8934327, 'lng': 107.6185513}",-68934327,1076185513,259,29,0
Curug Batu Templek,"Curug Batu Templek Bandung is a natural waterfall tourist attraction located in East Bandung City. Of the many natural waterfall attractions in Bandung, Curug Batu Templek is no less interesting because the surrounding scenery is filled with rocky cliffs. The history of Curug Batu Templek is very simple, only because in this place there was previously a stone quarry where there was a waterfall and it was known that the flow came from the river on the cliff, so it was called Curug Batu Templek.",Nature preserve,Bandung,5000,41,90.0,"{'lat': -6.874363300000001, 'lng': 107.6844023}",-68743633,1076844023,263,21,1
Museum Mandala Wangsit Siliwangi,"The Wangsit Mandala Siliwangi Museum is a military museum located in Bandung City, West Java. Siliwangi is the name of the TNI-AD military regional command in West Java and Banten whose name is taken from the king of the Sunda Kingdom whose capital was Pakuan Pajajaran, whose power was said to be unlimited, who was also wise and wise and had authority in running the government. Meanwhile, the meaning of Mandala Wangsit is a place to store messages, advice or advice from past warriors to future generations through the objects they left behind. This museum was inaugurated by the Siliwangi division commander Colonel Ibrahim Adjie on May 23 1966. This museum is located on Jalan Lembong, Sumurbandung district. This road is taken from the name of Lieutenant Colonel Lembong, one of the Siliwangi soldiers who was a victim in the Ratu Adil Army Coup Incident. Previously the street was called Oude Hospitaalweg.",Culture,Bandung,0,44,60.0,"{'lat': -6.9173405, 'lng': 107.6112627}",-69173405,1076112627,265,29,0
Taman Budaya Jawa Barat,"West Java Cultural Park (TBJB) was founded in 1991 in the Dago Tea House area. TBJB has the facilities of a closed theater building, open theater, exhibition hall, secretariat, arts studio, arts guesthouse and cafeteria. All of these facilities are intended for the smooth activities and work of Bandung residents, especially artists. TBJB holds various interesting agendas such as art performances, art competitions, art work experimentation, seminars, workshops, arts and culture workshops, book publishing, etc.",Culture,Bandung,0,43,120.0,"{'lat': -6.870099, 'lng': 107.6164386}",-6870099,1076164386,272,22,0
Curug Bugbrug,"Bugbrug Waterfall As the name suggests, the word Bugbrug in Sundanese means piled up or overlapping. So if you are asked why this waterfall in Bandung is called Curug Bugbrug then the answer is because the water that falls from top to bottom looks like it is piled up. And when the fall came, there was a sound at the bottom of the waterfall like â€ brugâ€¦brugâ€¦brug â€ so loud. The waterfall is at an altitude of 1,050 meters above sea level, has a height of 50 meters and the width of the waterfall is around 2 meters. This place is the center of interest for tourists on holiday in Bandung.",Nature preserve,Bandung,7500,43,120.0,"{'lat': -6.790388999999999, 'lng': 107.5777632}",-6790389,1075777632,273,21,1
Curug Cipanas,"Who says soaking in hot water has to dig deep into your pockets? West Bandung Regency has a solution for travelers who want to experience the benefits of genuine mountain hot springs without having to pay a fortune. It is Cipanas Nagrak Waterfall, a natural tourist attraction that offers natural hot springs. This hot spring is not just a pool, but is a natural waterfall in the middle of a plantation area. The spring flows freely into a small waterfall in the middle of green hilly land. Visitors will feel the sensation of soaking in a comfortable hot pool in the middle of open nature._x000D_",Nature preserve,Bandung,20000,39,180.0,"{'lat': -6.7991958, 'lng': 107.5922088}",-67991958,1075922088,275,25,1
Curug Cilengkrang,"Cilengkrang Waterfall could be a natural tourist destination in Bandung. Offers a cool forest area and a refreshing waterfall area. Even though it is not big, the waterfall area is enough to calm and refresh tourists. As if in contrast to the hustle and bustle of Bandung. Cilengkrang Waterfall offers natural tourism that is calm and very green. Stunning waterfalls, as well as forests with beautiful trees. Where, this place is also a living habitat for various wild animals that are still preserved.",Nature preserve,Bandung,7500,4,60.0,"{'lat': -6.8908877, 'lng': 107.7307085}",-68908877,1077307085,282,23,1
Taman Sejarah Bandung,"Bandung Historical Park is a park located behind Bandung City Hall, the Bandung City Government complex. This park functions to introduce history in the city of Bandung. This park is equipped with information about Bandung city leaders from time to time. The construction of this park cost around 3.5 billion rupiah.",Culture,Bandung,0,46,45.0,"{'lat': -6.9103086, 'lng': 107.6098619}",-69103086,1076098619,285,25,0
Taman Film,"Film Park is one of the thematic parks and public open spaces in Bandung City which is located under the Pasupati Bridge, Bandung, West Java. This park was inaugurated by the Mayor of Bandung, Ridwan Kamil, on September 14 2014. This park has a modern open-air cinema concept so that residents can do activities in the park and have the opportunity to watch films for free. The Film Park is managed by the Bandung Film Community and the Bandung City Parks Department.",Culture,Bandung,0,43,90.0,"{'lat': -6.8986869, 'lng': 107.6077451}",-68986869,1076077451,294,31,0
Mountain View Golf Club,"Welcome to Mountain View Golf Club Dago Pakar Bandung. The 72 par, 18 hole Golf Course has been designed by 5 times world champion from England Peter Thompson and of course the famous architect Ross Peret, located in a prestigious residential complex only 30 minutes from Bandung international airport or 20 minutes from the city center. Golfers and visitors sitting in the front row will be presented with views of the Club House and golf courses in the mountains close to the city of Bandung. Equipped with world class facilities, complete with VIP rooms, Massage Room, luxury lockers for men and women, Champions Bar, Restaurant and Golf Shop adjacent to the lobby entrance.",Nature preserve,Bandung,375000,44,120.0,"{'lat': -6.8629384, 'lng': 107.6482191}",-68629384,1076482191,297,27,1
Sendang Geulis Kahuripan,"This area is more precisely located in the Cikalong Wetan RPH, BKPH Padalarang Perum Perhutani BKPH North Bandung. Judging from the area, it reminds me of a tourist attraction in Central Java. More precisely, it is in Klaten, Umbul Ponggok. For Native friends who have been to Umbul Ponggok, this spring tourist attraction is almost exactly the same. It's just that this area is used multi-purpose. The meaning of multi-purpose is. The spring water that comes out of this tourist attraction is also used by some local people as a place to wash. Wait a minute, don't feel disgusted yet. The spring that produces this spring flows clean water almost every minute.",Nature preserve,Bandung,10000,43,120.0,"{'lat': -6.7495268, 'lng': 107.478658}",-67495268,107478658,299,17,1
Lereng Anteng Panoramic Coffee Place,"Lereng Anteng Panoramic Coffee is a fun hangout place in the form of a cafe and restaurant with a combination of cafes and natural tourist spots. This eating place was opened on June 1 2016 and occupies an area of around 500 m² and comes with a cozy concept. The name of this cafe is taken from the words Lereng which means a place on the outskirts of the highlands and Anteng (Sundanese) which means a place with a comfortable atmosphere. Apart from serving a variety of food and drink menus, Lereng Anteng Panoramic Coffee also offers an extraordinarily beautiful view.",Nature preserve,Bandung,50000,44,150.0,"{'lat': -6.842535, 'lng': 107.622698}",-6842535,107622698,301,11,1
Taman Bunga Cihideung,Cihideung Flower Park has a simple natural charm but is able to produce a landscape that attracts attention. The charm of this garden/flower garden is that it is only limited to flower-like plants. Then there are also several other attractions that make this natural tourist destination included in the Bandung tourist list. One of them is a very contemporary and instagrammable photo spot area which is the main target of teenage tourists. Especially for influencers who are looking for the perfect backdrop for content.,Nature preserve,Bandung,0,41,45.0,"{'lat': -6.8038883, 'lng': 107.5866313}",-68038883,1075866313,310,18,1
The Lodge Maribaya,"The Lodge Maribaya is one of the tourist attractions in Lembang which offers various things to visitors. Here we can do various activities such as camping, trekking around the beautiful pine forest area, gathering and team building events, or even just refreshing and enjoying culinary delights. There are also various rides which are definitely very Instagrammable. Surrounded by mountains with distinctive pine forests, the air and atmosphere here are really fresh. Want to hold a private gathering, or even a wedding here? really can. With a beautiful green mountain backdrop, it will certainly make your event more memorable.",Nature preserve,Bandung,25000,43,150.0,"{'lat': -6.829411199999999, 'lng': 107.6874666}",-68294112,1076874666,311,21,1
Taman Hutan Raya Ir. H. Juanda,"Grand Forest Park Ir. H. Djuanda (Tahura Djuanda) is an integrated conservation area between secondary nature and plantation forests of the Pine species (Pinus merkusil) located in the Cikapundung River Sub-Watershed and the Citarum Watershed which stretches from Curug Dago, Dago Pakar to Curug Maribaya which is part of the Mount Pulosari forest group. Tahura Djuanda is located in the north of Bandung City, approximately 7 km from the city center, geographically it is at 1070 30' East Longitude and 60 52' South Latitude, administratively it is in the Ciburial Village area, Cimenyan District, Bandung Regency and part of it is part of the Village Mekarwangi, Cibodas Village, Langensari Village, and Wangunharja Village, Lembang District, West Bandung Regency and Dago Village, Coblong District, Bandung City.",Nature preserve,Bandung,11000,45,90.0,"{'lat': -6.8585841, 'lng': 107.6306089}",-68585841,1076306089,312,25,1
Taman Begonia,"Bandung Begonia Park is located at an altitude of 1200 meters above the sea. Apart from balinea, there are various other types of flowers such as salvia, impatiens, geranium and celosia. It is so beautiful that many people say it is equivalent to Himawari no Sato Park in Japan. The Balinea flower itself is a type of Begonia flower that comes from Bali. Plants that are suitable for planting in various weather conditions will grow throughout the season. The Balinea flower is a plant that is often planted in plantations, hotel yards and city parks. The specialty of the Begonia Flower Garden is not only the presence of flowers and plants, but also the attractive garden arrangement. The colorful flower garden is also equipped with various shapes that are suitable for taking photos. In fact, many visitors come here just to capture the beauty of the park. Apart from that, because it is located in the highlands, visitors will definitely be comfortable doing activities there with cool and refreshing temperatures.",Nature preserve,Bandung,10000,44,90.0,"{'lat': -6.8260163, 'lng': 107.6383564}",-68260163,1076383564,313,21,1
Tafso Barn,"The name Punclut may be quite familiar to tourists. The highland area in Bandung has recently become popular as a tourist destination. Apart from offering beautiful views, this area also has many tourist attractions for recreation. One of them is the tourist area and restaurant Tafso and Boda Barn or often known as Tafso Barn. This recreation area combines a place to eat with a unique garden and warehouse feel. The view of the hills cut by the horizon is the main target for visitors. It's perfect to hang out and relax while on holiday in Bandung.",Nature preserve,Bandung,0,42,180.0,"{'lat': -6.8426446, 'lng': 107.6228408}",-68426446,1076228408,314,24,1
Curug Cimahi,"Curug Cimahi is a waterfall located on Jalan Colonel Masturi, Kertawangi Village, Cisarua District, West Bandung Regency, West Java. With a height of around 87 meters, this waterfall is one of the highest waterfalls in the Bandung area and its surroundings. The name Cimahi comes from the name of the river that flows above it, namely the Cimahi River which originates at Situ (lake) Lembang and flows into Cimahi City. This tourist destination is approximately 10 kilometers from Cimahi City towards Lembang or 20 kilometers from Bandung City.",Nature preserve,Bandung,15000,46,30.0,"{'lat': -6.797738300000002, 'lng': 107.5783691}",-67977383,1075783691,317,21,1
Pemandian Air Panas Cimanggu,Cimanggu Hot Springs is one of the tourist attractions in Bandung which offers a variety of attractions that are guaranteed to be amazing. This tourist spot is also known as Cimanggu Natural Hot Spring. Enjoying the hot springs and the green scenery in this bath can definitely make your mind more relaxed. A relaxed mind will definitely make you more enthusiastic when you return to work.,Nature preserve,Bandung,23000,39,60.0,"{'lat': -7.147152899999998, 'lng': 107.3901424}",-71471529,1073901424,320,18,1
Kebun Tanaman Obat Sari Alam,"The Sari Alam Medicinal Plant Garden is better known as herbal medicine tourism, because there are lots of plants there that are used as alternative medicine. The Sari Alam Medicinal Plant Garden is better known to Bandung people as KTO Sari Alam. Location: Jl. Raya Ciwidey Bandung km 26 no 8 rt 1 rw 2 Andir village, Cukanggenteng, Kec. Pasirjambu, Bandung district, West Java 40972",Nature preserve,Bandung,0,49,90.0,"{'lat': -6.601320999999999, 'lng': 106.632734}",-6601321,106632734,323,31,1
Happyfarm Ciwidey,"Natural and educational tourist attractions have mushroomed recently. Apart from De Ranch and Farmhouse Lembang, there is also Happy Farm Ciwidey in Bandung. This tourist attraction is still relatively new, because it was only established in June 2019. The concept is almost the same, nature and livestock tourism with educational elements. Very suitable as a family tourist destination, especially for children. And it's even more exciting because you play in an outdoor area with cool air._x000D_",Nature preserve,Bandung,15000,42,90.0,"{'lat': -7.1147877, 'lng': 107.4380865}",-71147877,1074380865,324,22,1
Gua Pawon,"Pawon Cave is a natural cave and ancient site located in Gunung Masigit Village, Cipatat District, Padalarang, West Bandung Regency, or about 25 km west of Bandung City. It is an important place for Sundanese people because it is the gathering place for Sundanese elders who now occupy the western part of the island of Java. There, an ancient human skeleton was found there which is said to be the ancestor of the Sundanese people (still being researched at the Bandung Archaeological Center)._x000D_",Nature preserve,Bandung,10000,45,90.0,"{'lat': -6.8231833, 'lng': 107.4371655}",-68231833,1074371655,328,24,1
Bukit Gantole Cililin,"Cililin Gantole Hill or also known as Gantole Venue is a tourist area which was initially opened for the purpose of holding the 2010 West Java Porda and the 2016 National Sports Week for Paragliding. This tourist area became the talk of the town after hosting the 2016 PON. Paragliding itself is a type of sport carried out on the slopes of hills or mountains using only the wind as the main source. Therefore, the location of Cililin Gantole Hill, which is at an altitude of 1063 meters above sea level with strong winds, is very suitable for this sport.",Nature preserve,Bandung,0,44,45.0,"{'lat': -6.9588812, 'lng': 107.4713147}",-69588812,1074713147,329,24,1
