Place_Name,Description,Categories,City,Price,Ratings,Time_Minutes,Coordinate,Lat,Long,_1,Rating_Count,Categories_Label
Museum Sonobudoyo Unit I,"Sonobudoyo Museum is a museum and library of Javanese history and culture in Yogyakarta, Indonesia. This museum contains the most complete collection of Javanese artifacts, after the National Museum in Jakarta. Apart from Neolithic era ceramics and 8th century bronze statues, this museum also holds a collection of wayang, various ancient weapons (such as keris), and Javanese masks. The Sonobudoyo Museum consists of two units, Unit I is located on Jalan Trikora No. 6 Yogyakarta, and Unit II is located in Ndalem Condrokiranan, Wijilan, to the east of the main square (north) of the city._x000D_",Culture,Yogyakarta,5000,46,120.0,"{'lat': -7.8024499, 'lng': 110.3639555}",-78024499,1103639555,118,22,0
Lava Bantal,"The DIY region offers a number of tourism potentials, especially river-based tourism. One of them which has now become one of the favorites of tourists is the Lava Pillow in Berbah District, Sleman Regency. As the name suggests, this tourist attraction offers rocks that are thought to have come from incandescent lava from underwater volcanoes that dried over hundreds of years ago. Lying on the Opak River, these rocks are a unique sight that can catch the attention of travelers. It is said that the existence of Pillow Lava contributed greatly to the formation of Java Island. Natural phenomena such as those that occur in Pillow Lava are very rare. On the island of Java, a similar phenomenon can only be found in Karangsambung (Kebumen), Ciletuh (West Java), and in Berbah (DIY). With a long geological historical background, since October 2 2014 the government has designated this tourist attraction as a geo heritage. This means that all the geological uniqueness in this tourist attraction is classified as an object protected by the government.",Culture,Yogyakarta,5000,44,30.0,"{'lat': -7.808151800000001, 'lng': 110.4595183}",-78081518,1104595183,119,20,0
Bukit Panguk Kediwung,"Panguk Kediwung Hill is a tourist attraction that offers natural views from a height. When compared to other hilly tourist attractions in Bantul, Panguk Kediwung Hill is relatively new because it opened in 2016. But make no mistake, this location has already stolen the hearts of many visitors from inside and outside the city. Panguk Kediwung Hill is located in Kediwung, Mangunan, Dlingo, Bantul, Yogyakarta. Don't worry about getting lost because along the road to the location we will see several signboards. Approximately 20 km from the center of Yogyakarta City. From the center of Yogyakarta City you can move south towards Jalan Imogiri Timur, follow the road until you find Imogiri Market, then turn left and continue your journey towards Dlingo, from there you will start to see signs for the road to Panguk Kediwung Hill. The access road to Panguk Kediwung Hill has been smoothly paved, but the contour is slightly up and down but is still in the safe category. It is highly recommended to use private vehicles because access here using public transportation is quite difficult.",Culture,Yogyakarta,250000,45,90.0,"{'lat': -7.9583695, 'lng': 110.4407622}",-79583695,1104407622,120,25,0
Watu Goyang,"Watu Goyang comes from Javanese which means rock that sways. Previously, at this place there was a rock at the top that could sway when touched or pushed. This stone has been around for hundreds of years. The managers explained that Watu Goyang never collapses even when touched or even climbed, but the management forbids visitors who try to climb Watu Goyang because it will be very dangerous for safety. The uniqueness of this giant rock is its structure which contains unique protrusions. The natural scenery is still green and Mount Merapi looks very natural, very suitable for visitors to get rid of boredom with daily activities in the city. Being at this peak, visitors will feel the cool air temperature, especially in the morning. And during the day, even though the weather is hot, the breeze that greets you feels fresh and comfortable.",Culture,Yogyakarta,2500,44,45.0,"{'lat': -7.9274086, 'lng': 110.4120586}",-79274086,1104120586,122,18,0
Alun-alun Utara Keraton Yogyakarta,"The north square or in Javanese called Alun-alun Lor is one of the land marks of the city of Yogyakarta in the form of a field in front of the Yogyakarta Palace. It is called Alun-alun Lor because in the city of Yogyakarta there are two squares located to the south and north of the Yogyakarta Palace. Alun-alun Lor is square with an area of 150 x 150 meters with two large banyan trees fenced in in the middle of the square. The two big banyan trees were respectively named Kyai Dewandaru and Kyai Wijayandaru. In the past, 63 banyan trees were planted around Lor Square which symbolized the age of the Prophet Muhammad SAW.",Culture,Yogyakarta,0,46,60.0,"{'lat': -7.803897499999998, 'lng': 110.3644232}",-78038975,1103644232,125,17,0
Watu Lumbung,"The location of the Watu Lumbung Educational Village is in a hilly area filled with groves of teak trees, making the views from this place very beautiful. Watu Lumbung was conceptualized by M Boy Rifai as a place that teaches educational values, where Boy Rifai has succeeded in turning barren land that was previously left alone, now into an exotic place to enjoy the night and see the sunset and sunrise. To maintain the beauty of the area around the tourist spot, the management deliberately built this area as a tourist area that is in harmony with nature.",Nature preserve,Yogyakarta,5000,43,30.0,"{'lat': -7.992437900000001, 'lng': 110.317778}",-79924379,110317778,131,18,1
Air Terjun Kedung Pedut,"Kedung Pedut Waterfall or commonly called Curug Kedung Pedut comes from a Javanese term. Curug means waterfall, kedung means puddle or pond, and pedut means fog. Kedung Pedut Waterfall is one of the natural attractions in Kulonprogo which is known for the beautiful color of its water.",Nature preserve,Yogyakarta,20000,45,60.0,"{'lat': -7.769987499999998, 'lng': 110.1210707}",-77699875,1101210707,132,22,1
Wisata Alam Kalibiru,"Kalibiru is actually the name of a forest which is currently being processed into a natural tourist spot. Kalibiru Forest has a height of 450 meters above sea level and is a fertile hilly area. The air temperature in this place is very cool. Kalibiru is managed by the government and local communities as a natural and educational tourist attraction. There are many things you can get there, including outbound, accommodation, and several spots to look for contemporary photos. There is also a trekking route which can also be used as a camping location.",Nature preserve,Yogyakarta,20000,44,90.0,"{'lat': -7.8057305, 'lng': 110.127969}",-78057305,110127969,137,16,1
Puncak Gunung Api Purba - Nglanggeran,"Mount Nglanggeran is a mountain in the Special Region of Yogyakarta, Indonesia. This mountain is an ancient volcano that was formed around 0.6-70 million years ago or has a tertiary age (Oligo-Miocene). Mount Nglanggeran has very distinctive rocks because they are dominated by volcanic agglomerates and breccia. This mountain is located in Nglanggeran Village, Patuk District, Gunung Kidul Regency which is in the Baturagung Mountain range.",Nature preserve,Yogyakarta,10000,47,60.0,"{'lat': -7.841252999999998, 'lng': 110.543056}",-7841253,110543056,139,17,1
Bunker Kaliadem Merapi,"Kaliadem Bunker is a tourist attraction located on the southern slopes of Mount Merapi. This tourist destination contains many traces of the volcanic eruption, especially in 2006 and 2010. This phenomenal location is at an altitude of more than 2,000 meters above sea level. Located in Sleman Regency, tourists are invited to witness the majesty of Merapi from a distance of five kilometers. This area combines the history, beauty and unique nature of Mount Merapi with its volcanic phenomena.",Nature preserve,Yogyakarta,3000,45,45.0,"{'lat': -7.582919800000001, 'lng': 110.4476816}",-75829198,1104476816,141,20,1
Ledok Sambi,"Ledok Sambi tourist village is a village that has an authentic Jogja natural feel, which is located close to Mount Merapi or on Jl. Kaliurang Km. 19.2 Padukuhan Sambi Pakembinangun Village District. Pakem Sleman Regency Yogyakarta Special Region. Beautiful natural views can provide coolness, freshness and peace of mind. As far as the eye can see in this tourist village you will be presented with vast expanses of natural and beautiful rice fields as well as shady green trees and clear water in the Ledok Sambi Tourism Village area. Jogja's spacious traditional houses are used as a place to play while enjoying the cool air that soothes the heart, soul and mind.",Nature preserve,Yogyakarta,0,46,150.0,"{'lat': -7.647094300000001, 'lng': 110.4280998}",-76470943,1104280998,142,28,1
Seribu Batu Songgo Langit,"The name Seribu Batu Songgo Langit has its own meaning. Before it became a tourist spot, at this location there were hundreds or even thousands of rocks and of course pine forests. Songgo Langit means supporting the sky, this is because in Seribu Baru Songgo Langit there is a hill which seems to be a pillar of the sky. Seribu Batu Songgo Langit is a tourist spot in the Dlingo area which offers various kinds of tourist attractions, but most of them are photo spots. Almost all of the photo spots in Seribu Batu are anti-mainstream. You will find several photo spots in four parts of this tourist attraction. Entering the Seribu Batu Songgo Langit gate you are required to go down the wooden stairs to reach the first spot. This first spot offers a fairy tale house of a thousand logs. This spot is in the form of a small house that resembles a dwarf's house in a fairy tale. There are seven dwarf houses arranged in a conical manner so that they create a good photo angle.",Nature preserve,Yogyakarta,2000,46,90.0,"{'lat': -7.931098399999999, 'lng': 110.430919}",-79310984,110430919,143,21,1
Goa Rancang Kencono,"Rancang Kencono Cave, located in Padukuhan Menggoran, Bleberan Village, Playen District, Gunungkidul, Yogyakarta, is one of the caves inhabited by prehistoric to modern humans. It is estimated that this cave, which is located in the Sri Getuk waterfall area, has been inhabited since 3000 years ago. From the book Variety of Cultural Heritage and Cultural Heritage of Gunungkidul written by Winarsih (Head of the Antiquities and Museums Section, Heritage and Cultural Values Preservation Division, Gunungkidul Cultural Service), Archeology UGM Yogyakarta in 2001 had already carried out this research. Rancang Kencono Cave has been inhabited by humans since 3000 years ago with evidence of human bones being found.",Nature preserve,Yogyakarta,5000,43,30.0,"{'lat': -7.9492612, 'lng': 110.4926511}",-79492612,1104926511,148,21,1
Goa Cerme,"Cerme Cave (Javanese: ê¦'ê¦¸ê¦®â€‹ê¦•ê¦ºê¦‚ê¦©ê¦º, translit. Cerme Cave) is a historical cave and also a tourist attraction located in Srunggo Hamlet , Selopamioro Village, Imogiri District, Bantul Regency or about 20 km south of Yogyakarta City. Cerme Cave is 1.5 km long which penetrates to the spring in the Panggang area, namely in Ploso Hamlet, Giritirto Village, Purwosari District, Gunungkidul Regency.\nBesides Cerme Cave, in the surrounding area there are other smaller caves such as Goa Dalang, Goa Ledek , Goa Badut and Goa Kaum which are often used for meditation. To reach the cave, there are stairs as high as 759 m. The word cerme comes from the word lecture which indicates a conversation held by walisongo. Cerme Cave was once used by the Walisongo to spread Islam in Java. Apart from that, Cerme Cave was also used to discuss plans to build the Great Mosque of Demak. Every Monday or Tuesday, a thanksgiving ceremony is always held to ask God for blessings.",Nature preserve,Yogyakarta,3000,44,90.0,"{'lat': -7.979441299999999, 'lng': 110.3803114}",-79794413,1103803114,149,23,1
Pantai Patihan,"This beach is located in the Srigading area, Sanden and quite close to Goa Cemara Beach. The place is also really fun for taking photos, not much different from Pandasari.",Nautical,Yogyakarta,5000,41,45.0,"{'lat': -7.997777999999999, 'lng': 110.2449113}",-7997778,1102449113,152,21,2
"Bukit Paralayang, Watugupit","Parangtritis Paragliding Hill is a tourist attraction in Yogyakarta, this place offers views of Parangtritis beach from the top of the hill at a height of 900 meters above sea level and views of the sunset. Apart from that, on the Parangtritis paragliding hill there is the extreme sport of paragliding, for tourists who are interested, there are experts accompanying them. Initially this hill was just an ordinary hill. Then in 1991 the first concrete runway was made to be used for paragliding. Then continued the construction of pavilion facilities, stairs and parking areas in 1998",Nature preserve,Yogyakarta,5000,47,90.0,"{'lat': -8.026855099999999, 'lng': 110.3459122}",-80268551,1103459122,161,13,1
Watu Mabur Mangunan,"The Watu Mabur Cliff area has not been known for long by the public. This actually happened because previously the tourism potential in the Mangunan area had not been developed to such an extent. In the past, the Watu Mabur Cliff Area was an area used for camping. The camping area itself is quite large and can accommodate dozens of large tents. Until now, the camping area still exists, but it is rarely used for camping activities, because in Yogyakarta there are so many spots for camping. Visiting the Watu Mabur Cliffs is incomplete if you don't try some of the photo spots which are currently very popular. The most famous photo spot is the highway / runway which ends directly facing the ravine. So when you take a photo in this place it feels like you are on an endless road._x000D_",Nature preserve,Yogyakarta,2500,45,60.0,"{'lat': -7.947121, 'lng': 110.441}",-7947121,110441,163,23,1
Pintoe Langit Dahromo,"Dahromo Sky Door provides various hit and instagrammable selfie spots with a panoramic backdrop of the special beauty of parts of the city of Jogja. There are various photo spots such as photo spots of houses with flowers around them, sky doors, love-shaped viewing posts, and also dragonfly wings. Dahromo Heavenly Doors is located on Jl. Dahromo, Karang Asem, Muntuk, Dlingo, Bantul, Yogyakarta Special Region 55783. Precisely on the hilly tourist route south of Lintang Sewu hill. To reach the Heaven's Gate, the route is quite easy because it is close to other tourist attractions.",Nature preserve,Yogyakarta,2500,44,60.0,"{'lat': -7.913608000000001, 'lng': 110.437783}",-7913608,110437783,164,18,1
Geoforest Watu Payung Turunan,"For hunters of the beauty of the sunrise who live or are domiciled in Yogyakarta and its surroundings, the Watu Payung Turunan Geoforest is the right destination. The beauty of the sunrise, natural panorama and unique ornaments are the perfect combination presented at the Watu Payung Derunan Geoforest. Not only for taking photos, this tourist attraction is also suitable for just relaxing and enjoying the beauty of the morning.",Nature preserve,Yogyakarta,0,45,60.0,"{'lat': -7.974294, 'lng': 110.4364363}",-7974294,1104364363,167,33,1
Pantai Timang,"Timang Beach is a tourist attraction in the form of a beach, namely the area that is the boundary between the sea and land located in Gunungkidul Regency, Special Region of Yogyakarta. Timang Beach is one of the beaches in Yogyakarta with white sand. Timang Beach is located between Siung Beach and Sundak Beach, Gunungkidul. Access to this beach is quite difficult, many roads to this beach are still not paved because the location of this beach is quite remote. The unique thing about this beach is that there is an island which is a habitat for sea lobsters on the other side of the beach._x000D_",Nautical,Yogyakarta,10000,47,90.0,"{'lat': -8.1759266, 'lng': 110.6624196}",-81759266,1106624196,168,22,2
Puncak Segoro,"Puncak Segoro is the newest tourist destination in Yogyakarta which offers a charming sunset. Puncak Segoro Jogja itself is located on the southern coast of Yogyakarta. Why is it called Puncak Segoro, because its location is above the ocean with extraordinary natural landscape views. In the form of high cliffs overlooking the South Sea, the beauty of the panorama presented is very special.",Nature preserve,Yogyakarta,5000,42,90.0,"{'lat': -8.1026167, 'lng': 110.4562084}",-81026167,1104562084,169,30,1
Candi Borobudur,"Borobudur (Javanese: ê¦•ê¦¤ê§€ê¦ ê¦¶â€‹ê¦§ê¦«ê¦§ê¦¸ê¦ ê¦¸ê¦‚, translit. Barabudhur Temple) is a Buddhist temple located in Borobudur, Magelang, Central Java, Indonesia. This temple is located approximately 100 km southwest of Semarang, 86 km west of Surakarta, and 40 km northwest of Yogyakarta. This stupa-shaped temple was founded by followers of Mahayana Buddhism around 800 AD during the reign of the Syailendra dynasty. Borobudur is the largest Buddhist temple or shrine in the world, as well as one of the largest Buddhist monuments in the world.\nThis monument consists of six square terraces on top of which there are three circular courtyards, the walls are decorated with 2,672 relief panels and originally there were 504 Buddha statues . Borobudur has the most complete and largest collection of Buddhist reliefs in the world. The largest main stupa is located in the center and crowns this building, surrounded by three circular rows of 72 perforated stupas in which there is a statue of Buddha sitting cross-legged in a perfect lotus position with the Dharmachakra mudra (turning the wheel of dharma).\nThis monument is a model of the universe and was built as a holy place to glorify Buddha as well as functioning as a place of pilgrimage to guide humanity from the realm of worldly desires to enlightenment and wisdom according to Buddhist teachings. Pilgrims enter via the east side and begin the ritual at the base of the temple by walking in a clockwise circle around this sacred building, while continuing to climb the next steps through the three realms of Buddhist cosmology. The three levels are KÄ madhÄ tu (the realm of lust), Rupadhatu (the realm of form), and Arupadhatu (the realm of intangibility). On their journey, pilgrims walk through a series of hallways and stairs and see no less than 1,460 beautiful relief panels carved on the walls and balustrades.\nAccording to historical evidence, Borobudur was abandoned in the 14th century as the influence of the Hindu and Buddhist kingdoms in Java weakened. and the beginning of the influence of Islam. The world began to become aware of the existence of this building since it was discovered in 1814 by Sir Thomas Stamford Raffles, who at that time served as British Governor General of Java. Since then Borobudur has undergone a series of rescue and restoration efforts. The largest restoration project was carried out in the period 1975 to 1982 through the efforts of the Government of the Republic of Indonesia and UNESCO, then this historic site was included in the list of World Heritage Sites. Borobudur is still used as a place of religious pilgrimage; Every year Buddhists who come from all over Indonesia and abroad gather at Borobudur to commemorate the Vesak Trisuci. In the world of tourism, Borobudur is the single tourist attraction in Indonesia that is most visited by tourists.",Culture,Yogyakarta,50000,47,120.0,"{'lat': -7.6078738, 'lng': 110.2037513}",-76078738,1102037513,170,19,0
Candi Ijo,"Ijo Temple (Javanese: ê¦•ê¦¤ê§€ê¦ ê¦¶â€‹ê¦†ê¦—ê¦ºê¦´, translit. Candhi Ijo) is a Hindu temple complex, located 4 kilometers southeast of Ratu Boko Temple or approximately 18 kilometers east of the city of Yogyakarta. This temple is estimated to have been built between the 10th and 11th centuries AD during the Medang Kingdom era in the Mataram period._x000D_",Culture,Yogyakarta,5000,46,60.0,"{'lat': -7.783827600000001, 'lng': 110.5118987}",-77838276,1105118987,171,23,0
Pasar Beringharjo,"Beringharjo Market (Javanese: ê¦¥ê¦±ê¦‚ê¦§ê¦¼ê¦«ê¦¶ê¦ ê¦²ê¦‚ê¦—, translit. Beringharjo Market) is the oldest market with historical and philosophical value which cannot be separated from the Yogyakarta Palace. Beringharjo has the literal meaning of a banyan tree forest which is expected to provide prosperity for the people of Yogyakarta. Beringharjo Market is located on Jalan Jenderal Ahmad Yani number 16, Yogyakarta. There are many types of goods that can be purchased at Beringharjo Market, ranging from batik, market snacks, old money, children's and adult clothing, fast food, basic ingredients for traditional herbal medicine, basic necessities to antiques.",Shopping center,Yogyakarta,0,45,60.0,"{'lat': -7.798794300000001, 'lng': 110.367443}",-77987943,110367443,174,31,3
Museum Ullen Sentalu,"Ullen Sentalu Museum, (Javanese: ê¦©ê¦¸ê¦±ê¦¶ê¦ªê¦¸ê¦©ê§€â€‹ê¦ˆê¦ê§€ê¦ê¦ºê¦¤ê§ €â€‹ê¦±ê¦¼ê¦¤ê§€ê¦ ê¦ê¦¸, translit. Musiyum UllÃ¨n Sentalu) is located in Pakem District (Kaliurang), Sleman Regency, Special Region of Yogyakarta, is a museum that displays culture and life of the nobles of the Mataram Dynasty (Kasunanan Surakarta, Sultanate of Yogyakarta, Praja Mangkunegaran, and Duchy of Pakualaman) along with a collection of various batik (both Yogyakarta and Surakarta styles).\nThis museum also displays figures of kings and their queens in various kinds of clothing. worn, both for formal events and for everyday life. \nThe name Ullen Sentalu is an acronym from Javanese: ""ULating bLENcong SEjatiNe TAtaraning LUmaku"" which means ""The flame of the blencong lamp as a guide for mankind in moving forward and pursuing life"". This philosophy is taken from an oil lamp used in wayang kulit performances (blencong) which is a light that is always moving to direct and illuminate our life journey. This museum was founded by a Yogyakarta nobleman who was known to be very close to the Surakarta and Yogyakarta royal families.\nAt the Ullen Sentalu Museum, you can find out how Javanese ancestors made batik which has deep significance and meaning in each pattern. There is also various history regarding the state of Javanese culture from the Ancient Mataram period to Islamic Mataram with all its rules. The condition of a well-built museum can make visitors feel like they have been absorbed into the amazing era of ancient Java._x000D_",Culture,Yogyakarta,100000,47,120.0,"{'lat': -7.5978656, 'lng': 110.4233959}",-75978656,1104233959,175,12,0
Museum Gunung Merapi,"Mount Merapi Museum (Javanese: ê§‹ê¦©ê¦¸ê¦±ê¦¶ê¦ªê¦¸ê¦©ê§€â€‹ ê¦'ê¦¸ê¦¤ê¦¸ê¦ â€‹ ê¦©ê¦¼ê¦«ê¦¥ê¦¶ê§‰, translit Musiyum Gunung Merapi) is a historical museum located in Yogyakarta, precisely on Jln. Boyong, Banteng Hamlet, Hargobinangun Village, Pakem District, Sleman Regency, Yogyakarta Special Region, about five kilometers from the Kaliurang tourist attraction area. The Mount Merapi Museum was inaugurated on October 1 2009 by the Minister of Energy and Mineral Resources (ESDM), Purnomo Yusgiantoro.\nWith a building area of around 4,470 meters standing on 3.5 hectares of land, the future museum will also be equipped with a garden. The public wants to know the public as the Merapi Volcano Museum, the parking area and plaza with the slogan Merapi Window of the Earth. to provide insight and understanding of scientific, socio-cultural and other aspects related to volcanoes and other sources of geological disasters. It is hoped that the Volcano Museum can be an alternative solution as a very important and potential facility as a volcanic information service center in an effort to educate people's lives, as well as as a medium for increasing public awareness and vigilance about the benefits and threats of volcanic eruptions and other geological disasters.",Culture,Yogyakarta,10000,44,60.0,"{'lat': -7.615927200000001, 'lng': 110.4243329}",-76159272,1104243329,176,22,0
Candi Ratu Boko,"Ratu Baka Site or Boko Temple (Hanacaraka:ê¦•ê¦¤ê§€ê¦ ê¦¶â€‹ê¦«ê¦ ê¦¸â€‹ê¦§ê¦ , Javanese: Ratu Baka Temple) is an ancient site which is a complex of a number of remaining buildings located approximately 3 km south of the Prambanan Temple complex, 18 km east of Yogyakarta City or 50 km southwest of Surakarta City, Central Java, Indonesia. The Ratu Boko site is located on a hill at an altitude of 196 meters above sea level. The total area of the complex is approximately 25 ha.",Culture,Yogyakarta,75000,46,90.0,"{'lat': -7.7705416, 'lng': 110.4894158}",-77705416,1104894158,179,23,0
Hutan Mangrove Kulon Progo,"Here there is the Kulon Progo Mangrove Forest tourist area which presents its natural beauty. This mangrove forest provides its own charm apart from Glagah beach which has become a favorite in Kulon Progo. The location of the Kulon Progo mangrove forest is actually in the Pasir Mendit area, Temon Kulon Progo District._x000D_",Nautical,Yogyakarta,5000,41,120.0,"{'lat': -7.8933459, 'lng': 110.0198257}",-78933459,1100198257,182,17,2
Pantai Sepanjang,"Who would have thought, it turns out that Yogyakarta also has its own ""Kuta"", namely Panjang Beach, one of the beaches in Gunungkidul Regency. This area does have a collection of countless beautiful beaches. In fact, this beach is predicted to be 'Kuta Tempo Doeloe'. Indeed, what kind of charm does this beach offer?",Nautical,Yogyakarta,10000,44,120.0,"{'lat': -8.136665599999999, 'lng': 110.5659962}",-81366656,1105659962,184,18,2
