Place_Name,Description,Categories,City,Price,Ratings,Time_Minutes,Coordinate,Lat,Long,_1,Rating_Count,Categories_Label
Monumen Nasional,"The National Monument or what is popularly known as Monas or Tugu Monas is a 132 meter (433 foot) high memorial monument which was erected to commemorate the resistance and struggle of the Indonesian people to gain independence from the Dutch East Indies colonial administration. Construction of this monument began on 17 August 1961 under the orders of President Sukarno and was opened to the public on 12 July 1975. This monument is crowned with a flame covered in gold leaf which symbolizes the burning spirit of struggle. The National Monument is located right in the middle of Medan Merdeka Square, Central Jakarta.",Culture,Jakarta,20000,46,15.0,"{'lat': -6.1753924, 'lng': 106.8271528}",-61753924,1068271528,1,18,0
Kota Tua,"The old city in Jakarta, which is also called Kota Tua, is centered on Alun-Alun Fatahillah, which is a busy square with routine performances of traditional dances. The Jakarta History Museum is a Dutch-era building with paintings and antiques, while the Wayang Museum displays Javanese wooden puppets. Glodok Village, or Chinatown, is famous for its street food, such as dumplings and fried noodles. Nearby, there are schooners and fishing boats in the quaint Sunda Kelapa harbor",Culture,Jakarta,0,46,90.0,"{'lat': -6.137644799999999, 'lng': 106.8171245}",-61376448,1068171245,2,25,0
Pasar Seni,"The Art Market is a craft and arts center which is a forum for talented artists to channel their artistic crafts. Artists can meet with art collectors and entrepreneurs to share information and market their products. It was founded in early 1977, with the laying of the first stone by Bang Ali Sadikin, the first Governor of DKI Jakarta, precisely in July 1977. And it was inaugurated by Governor H. Tjokropanolo on December 17 1977. Since the inauguration of Pasar Seni, it has received a positive response from art lovers. which exists.",Shopping center,Jakarta,0,44,90.0,"{'lat': -6.1766868, 'lng': 106.8417666}",-61766868,1068417666,15,25,3
Museum Taman Prasasti,"Taman Prasasti Museum is a cultural heritage museum from the Dutch colonial period located on Jalan Tanah Abang No. 1, Central Jakarta. This museum has a collection of ancient tombstone inscriptions and miniatures of typical tombs from 27 provinces in Indonesia, along with a collection of antique hearses. This 1.2 ha museum is an open-air museum that displays works of art from the past about the sophistication of sculptors, sculptors, calligraphers and writers combined._x000D_",Culture,Jakarta,2000,45,90.0,"{'lat': -6.172224099999998, 'lng': 106.8189695}",-61722241,1068189695,20,18,0
Museum Wayang,"The Wayang Museum is a museum located on Jalan Pintu Besar Utara Number 27, West Jakarta.",Culture,Jakarta,5000,45,150.0,"{'lat': -6.1349072, 'lng': 106.8124452}",-61349072,1068124452,21,25,0
Pasar Tanah Abang,"Tanah Abang Market or Saturday Market was built by Yustinus Vinck on August 30 1735. Yustinus Vinck founded Tanah Abang Market with permission from Governor General Abraham Patramini. The permit given at that time for Tanah Abang Market was to sell textiles and grocery items and was only open every Saturday. Therefore, this market is called the Saturday Market. This market was able to compete with Senen Market (Welter Vreden) which was already advanced.\nIn 1740 the Chinatown Riot incident occurred, namely the massacre of Chinese people, destruction of property, including Tanah Abang Market which was ravaged and burned. In 1881, Tanah Abang Market was rebuilt and which was previously open on Saturdays, Wednesdays were added, so that Tanah Abang Market was opened twice a week. The market building was originally very simple, consisting of bamboo walls and planks and a thatched roof made of 229 planks and 139 bamboo plots. Tanah Abang Market continued to undergo improvements until the end of the 19th century and the floor began to be hardened with a mortar foundation. In 1913, Tanah Abang Market was repaired again. In 1926 the Batavian government demolished the Tanah Abang Market and replaced it with a permanent building in the form of three long stalls made of walls and boards and a tile roof, with the market office located on top of a market building similar to a birdcage. The parking lot in front of the market is a place to park the horses pulling the wagons and carts. There was a fairly large pool of water there, and across the road there was a shop that specialized in selling horse bran feed. A few tens of meters from the bran shop there is an alley known as Alley Madat, a place where compactors were localized.\nDuring the Japanese occupation, this market barely functioned, and became a place for homeless people.\nTanah Abang Market continued to develop after the construction of Tanah Abang Station. In this place, places such as the Al Makmur Mosque and the Hok Tek Tjen Sien Temple began to be built, both of which are the same age as Tanah Abang Market. In 1973, Tanah Abang Market was rejuvenated, replaced with 4 four-story buildings, and experienced two fires, the first on 30 December 1978, in Block A on the third floor and the second in Block B on 13 August 1979. In 1975 it was recorded that the stalls were still there. 4,351 units with 3,016 traders.",Shopping center,Jakarta,0,4,45.0,"{'lat': -6.189009599999999, 'lng': 106.8119312}",-61890096,1068119312,25,26,3
Pecinan Glodok,"The Glodok area, which is known as an electronic trading center, was once the haunted former Glodok Prison. This location is opposite Glodok-Pancoran in the Harco area. Before the May 1998 riots, this area had become an electronics shopping center for Japanese, Taiwanese and Hong Kong tourists. In Pinangsia, people can find household and building equipment products. Apart from shopping tourism, Glodok-Pancoran Chinatown is also a historical site of the beginnings of the city of Jakarta. After ethnic Chinese settled and built businesses and sugar cane plantations, Batavia began to develop rapidly.",Shopping center,Jakarta,0,43,20.0,"{'lat': -6.142758799999999, 'lng': 106.8140791}",-61427588,1068140791,26,24,3
Pasar Taman Puring,"Puring Park is not a literal park. Since its existence in 1960, Taman Puring has been a market. Over the years, this market has become a black market, aka a market for illegal goods. Between the 1980s and 1990s, this market became increasingly shunned by the public because it became a center for goods resulting from criminal acts. Since it burned down in 2002, Taman Puring Market has slowly improved itself until it is now a favorite weekend shopping destination for Jakarta residents. There are hundreds of men's shoe stalls ranging from leather shoes, mountain shoes, futsal shoes, to trendy shoes typical of young people. Various brands ranging from Adidas, Caterpillar, Nike, Karrimor, Vans, to Converse are available in various models and colors.",Shopping center,Jakarta,0,44,60.0,"{'lat': -6.241368999999999, 'lng': 106.7890587}",-6241369,1067890587,34,23,3
Grand Indonesia Mall,"Grand Indonesia is a mall in Jakarta. This mall was opened in 2007 by President Susilo Bambang Yudhoyono. In 2007, Hotel Indonesia underwent renovation. Furthermore, after reopening, the hotel was managed by the Kempinski group and its name was changed to Hotel Indonesia-Kempinski.",Shopping center,Jakarta,0,47,120.0,"{'lat': -6.195180099999999, 'lng': 106.8204412}",-61951801,1068204412,35,27,3
Museum Macan (Modern and Contemporary Art in Nusantara),"The Museum of Modern and Contemporary Art in the Archipelago or Museum MACAN is an art museum in Kebon Jeruk in Jakarta, Indonesia. This museum is the first in Indonesia to have a collection of Indonesian and international modern and contemporary art.",Culture,Jakarta,100000,45,120.0,"{'lat': -6.190942, 'lng': 106.767622}",-6190942,106767622,39,26,0
Museum Bahari Jakarta,"The Maritime Museum is a museum that holds collections related to maritime affairs and the service of the Indonesian people from Sabang to Merauke, which is located opposite the Sunda Kelapa Harbor. The museum is one of eight museums under the supervision of the Museum Culture Service of the Special Capital Region of Jakarta Province.",Culture,Jakarta,2000,44,120.0,"{'lat': -6.1269553, 'lng': 106.8085899}",-61269553,1068085899,41,26,0
Monumen Selamat Datang,"Selamat Datang Monument is a monument located in the middle of the Hotel Indonesia Roundabout, Jakarta, Indonesia. This monument is a statue of a pair of people holding flowers and waving their hands. The statues face north which means they welcome people coming from the direction of the National Monument._x000D_",Culture,Jakarta,0,47,15.0,"{'lat': -6.194997799999999, 'lng': 106.8230496}",-61949978,1068230496,44,19,0
Galeri Indonesia Kaya,"Galeri Indonesia Kaya (abbreviated as GIK) is a public space that combines educational and digital concepts with the aim of introducing and appreciating Indonesian art and culture, especially to the younger generation, located at Grand Indonesia, Jakarta, Indonesia. The Indonesia Kaya Gallery was initiated and built to become a digital technology-based cultural edutainment space that can bring closer and channel the creative expression of the younger generation within the scope of Indonesian cultural traditions. This place has an auditorium that can be used for people who need a place to work.",Culture,Jakarta,0,48,90.0,"{'lat': -6.1948499, 'lng': 106.8200607}",-61948499,1068200607,49,26,0
Rumah Sipitung,"The Si Pitung House in Marunda, North Jakarta, Indonesia, is one of the few remaining Betawi stilt houses. This stilt house is a representation of the stilt dwelling of the Betawi people who live in coastal areas. This house is a museum and is included in the cultural heritage. It is not known exactly when Rumah Si Pitung was founded. It is estimated that the building was built in the 20th century. This stilt house, which is often called the Marunda Tinggi House, is similar to the traditional house of the Bugis tribe. This house previously belonged to Haji Saipudin, a rich fish dealer from Makassar (other sources say Haji Saipudin was a juragan sero, or ship tycoon). Haji Saipuddin is believed to be a close friend of Si Pitung. Pitung is thought to have only stopped at the house a few times (estimated to be in the 1890s). Si Pitung's last stop was in order to hide from being chased by Dutch soldiers on charges of robbery. The DKI Jakarta government first restored the stilt house which is supported by 40 pillars in 1972. Previously in the same year this building was purchased by the DKI Jakarta Provincial Government from the descendants (heirs) of H. Saipudin. The building is now a museum and is included in cultural heritage based on Governor's Decree No.475 of 1993 and Ministerial Decree No.140/M/1998. The institution that named this original Pesisir Betawi house as Si Pitung's house is the National Museum.",Culture,Jakarta,5000,45,90.0,"{'lat': -6.10016, 'lng': 106.96057}",-610016,10696057,53,30,0
Museum Tekstil,"The Textile Love Museum occupies an old building on Jalan KS Tubun / Kota Bambu Selatan No. 4 Palmerah District, West Jakarta\n\nThe building itself was originally the private house of a French citizen built in the 19th century. Then it was bought by the Turkish consul named Abdul Azis Almussawi Al Kazimi who lives in Indonesia. Then in 1942 it was sold to Dr. Karel Christian Cruq.\nDuring the struggle for Indonesian independence, this building was the headquarters of the People's Security Front (BKR) and in 1947 was occupied by Lie Sion Pin. In 1952 it was purchased by the Ministry of Social Affairs and on 25 October 1975 it was handed over to the Regional Government of DKI Jakarta and then on 28 June 1976 its use was inaugurated by Mrs. Tien Soeharto as a Textile Museum.",Culture,Jakarta,5000,45,45.0,"{'lat': -6.187963400000002, 'lng': 106.8096081}",-61879634,1068096081,60,17,0
Museum Kebangkitan Nasional,"The National Awakening Museum (English: Museum of National Awakening) is a building built as a monument where national consciousness was born and developed and where the first modern movement organization was discovered under the name Boedi Oetomo. Before becoming a museum, this building was formerly a medical school founded by the Dutch with the name School tot Opleiding van Inlandsche Artsen abbreviated as STOVIA or Bumiputra Doctor's School. Along the way, the building always changed functions. The location of this museum is not far from Senen Market, precisely on Jalan Abdurrahman Saleh No.26, before Gatot Subroto Army Hospital, Central Jakarta.",Culture,Jakarta,2000,47,45.0,"{'lat': -6.178352, 'lng': 106.838094}",-6178352,106838094,63,19,0
Museum Sasmita Loka Ahmad Yani,"The Sasmita Loka Ahmad Yani Museum is a national hero museum located on Jalan Lembang No. 58 and Laruharhari street no. 65, Central Jakarta, DKI Jakarta, Indonesia. This museum is open to the public from Tuesday to Sunday, from 08:00 to 14:00 WIB. Every Monday the museum is closed to the public.",Culture,Jakarta,2000,47,45.0,"{'lat': -6.204630300000001, 'lng': 106.8365324}",-62046303,1068365324,64,24,0
Museum Basoeki Abdullah,"The Basoeki Abdullah Museum contains paintings and Basoeki Abdullah's personal collections such as statues, masks, puppets and weapons. This museum, located in South Jakarta, is managed by the Ministry of Education and Culture. Apart from being used for exhibitions, this museum is also used to hold seminars, research, workshops and publish various forms of publications in the form of catalogs, biographies, collections of articles and research results._x000D_",Culture,Jakarta,1000,46,90.0,"{'lat': -6.289788499999998, 'lng': 106.7932681}",-62897885,1067932681,65,19,0
Museum Layang-layang,"The Kite Museum is a museum located on Jl. H. Kamang No. 38, Pondok Labu, South Jakarta. This museum is the first kite museum in Indonesia. The number of kite collections in this museum is 600, but this number continues to increase with the arrival of new collections from local and overseas kites as well as kites made themselves by museum employees. The Kite Museum is open every day from 09.00-16.00 WIB. National holidays The Kite Museum is closed.",Culture,Jakarta,10000,45,90.0,"{'lat': -6.3080282, 'lng': 106.790548}",-63080282,106790548,66,21,0
Margasatwa Muara Angke,"The Muara Angke wildlife reserve is a conservation area based on the Decree of the Minister of Forestry of the Republic of Indonesia Number: 097/Kpts-II/1988, 29 February 1998 in the mangrove forest area on the north coast of Jakarta. Administratively, this area includes the Kapuk Muara Village area, Penjaringan District, North Jakarta Municipality.",Nature preserve,Jakarta,25000,42,15.0,"{'lat': -6.1160075, 'lng': 106.7692016}",-61160075,1067692016,67,18,1
Pasar Petak Sembilan,"Glodok Chinatown, precisely at Petak Sembilan Market, West Jakarta, is a place that sells various kinds of typical Chinese culinary delights. This area, which is mostly inhabited by Chinese people, is famous for its typical Chinese culinary delights which are sold by many residents. Starting from basket cakes, dodol cakes, to layer cakes, many are sold here. With prices ranging from IDR 30 thousand to IDR 100 thousand, these three types of cake are the cakes most often purchased to complement Chinese New Year celebrations. According to sources from sellers, they admitted that the cakes they sold were imported directly from various regions. Because they come from different regions, these cakes have their own characteristics.",Shopping center,Jakarta,0,44,45.0,"{'lat': -6.143672200000001, 'lng': 106.8129398}",-61436722,1068129398,68,26,3
Perpustakaan Nasional,"The National Library is a library specifically established by the National Government to store information about that country. In contrast to public libraries, it is very rare for the general public to borrow books. Often a national library holds rare and historical collections.\nSome early libraries could be called national libraries, such as the Library of Alexandria which was an Ancient Egyptian Library. National libraries are often very large and spacious, especially when compared with other regular libraries in their country. Some countries that are not independent, but still wish to preserve their special culture generally establish a national library with all the institutional attributes of a legal deposit.\nMany national libraries collaborate with the International Federation of Library Associations and Institutions (English: International Federation of Library Associations and Institutions (IFLA)) to discuss general tasks, establish and promote general standards and implement projects to help fulfill their tasks. National libraries in Europe participate in the European Library. This is a service of the Conference of European National Librarians (CENL).\nOne of the first plans for a national library was designed by the mathematician, John Dee, in 1556 which was shown to Mary I of England with a visionary plan for the preservation of old books, manuscripts, and records and the establishment of a national library, but the proposal was not approved.",Culture,Jakarta,0,47,240.0,"{'lat': -6.181291799999999, 'lng': 106.8268717}",-61812918,1068268717,70,23,0
Museum Tengah Kebun,"Museum in Tengah Kebun is a museum storing Â± 4,000 collections of Indonesian and foreign art and history located in the Kemang area, South Jakarta. This museum was built in the middle of a 3,500 m2 garden. This museum is privately owned by Sjahrial Djalil, one of Indonesia's modern advertising figures and founder of the advertising agency Ad Force Inc. In 2013, this museum was selected as the Best Private Museum at the Museum Awards with collections from 63 countries and 26 provinces in Indonesia.[2] What makes this museum different from other museums is the arrangement of the 2,414 collections on display to visitors, placed irregularly in various corners of the room, such as the floor, garden area, toilet, outside walls of the house, and so on.",Culture,Jakarta,0,46,120.0,"{'lat': -6.267513, 'lng': 106.824107}",-6267513,106824107,74,26,0
Plaza Indonesia,"Plaza Indonesia was inaugurated in early 1990, consisting of four floors of upscale shops with an area of 38,050 m2. This shopping center is located at the Hotel Indonesia Roundabout, precisely between Jalan MH Thamrin and Jalan Kebon Kacang Raya in Jakarta's main business district.\nPlaza Indonesia is also equipped with the Grand Hyatt Jakarta hotel, a 28-story five-star hotel which was officially opened at the beginning of the year. 1990. This hotel has more than 300 rooms with a modern minimalist design, exclusive restaurants and very complete facilities.\nThe development of Plaza Indonesia continued when Entertainment X'nter opened next to the existing building targeting the young market share. The two buildings are connected by a bridge surrounded by shops.\nNow, Plaza Indonesia has been equipped with the office building The Plaza Office Tower and the Keraton Grand Hyatt Residences apartment.\nPlaza Indonesia was developed by PT Global Land Development Tbk (formerly known as PT Kridaperdana Indahgraha Tbk).",Shopping center,Jakarta,0,47,120.0,"{'lat': -6.193925900000002, 'lng': 106.8222158}",-61939259,1068222158,80,26,3
Mall Thamrin City,"Thamrin City or Thamrin City Mall is a large shopping center in Central Jakarta, which is located Â± 150 meters from the Hotel Indonesia roundabout and Â± 300 meters from Tanah Abang Market, which is precisely on Jl. Thamrin Boulevard (formerly Kebon Kacang Raya) with access in various directions, including from Jl. Thamrin, Jl. Betung Bay, as well as from Jl. KH. Mas Mansour",Shopping center,Jakarta,0,44,60.0,"{'lat': -6.1946096, 'lng': 106.817905}",-61946096,106817905,81,23,3
Museum Satria Mandala,"The Satria Mandala Museum is a museum of the history of the struggle of the Indonesian National Army located on Jalan Gatot Subroto, South Jakarta. This museum, which was inaugurated in 1972 by the former President of Indonesia, Soeharto, was originally the home of one of the wives of the former President of Indonesia, Soekarno, namely his wife, Ratna Sari Dewi Soekarno. In this museum you can find various collections of war equipment in Indonesia, from the past to the modern, such as collections of mines, missiles, torpedoes, tanks, cannons and even helicopters and airplanes (one of which is the Cureng plane which was flown by Air Marshal Agustinus Adisucipto). \nApart from that, this museum also stores various historical objects related to the TNI, such as various heavy and light weapons, military attributes, banners and symbols within the TNI. Apart from that, this museum also displays the stretcher that was used to carry Commander-in-Chief General Soedirman when he was sick in his guerrilla campaign against the Dutch re-occupation in the 1940s.\nStill in the Satriamandala TNI Museum complex there is also the Purbawisesa Alert Museum which displays dioramas of the TNI era. together with the people crushed the DI/TII separatist gangs in West Java, Central Java, Aceh, South Kalimantan and South Sulawesi in the 1960s. Other facilities at the Satriamandala TNI Museum include a Children's Reading Garden, Souvenir Kiosk, Canteen and a Multipurpose Building with a capacity of 600 seats.",Culture,Jakarta,5000,45,150.0,"{'lat': -6.231698499999999, 'lng': 106.8185425}",-62316985,1068185425,82,23,0
Museum Benteng Vredeburg Yogyakarta,"Vredeburg Fort Museum (Javanese: ê¦©ê¦¸ê¦±ê¦¶ê¦ªê¦¸ê¦©ê§€â€‹ê¦§ê¦ºê¦ ê¦ºê¦ â€‹ê¦® ê¦³ê¦½ê¦¢ê¦¼ê¦§ê¦¸ê¦‚ê¦'ê§€, translit. Musiyum BÃ¨tÃ¨ng Vredeburg is a fort located in front of the Great Building and the Palace of the Current Sultanate of Yogyakarta. This fort is a museum. In a number of buildings inside this fort there are dioramas about Indonesian history.",Culture,Yogyakarta,3000,46,120.0,"{'lat': -7.800201599999999, 'lng': 110.3663044}",-78002016,1103663044,88,32,0
Monumen Yogya Kembali,"Yogya Lagi Monument Museum (Javanese: ê¦©ê¦ºê¦´ê¦¤ê¦¸ê¦©ê¦ºê¦¤ê§€â€‹ê¦ªê¦ºê¦´ê¦'ê¦¾â€ ‹ê¦ ê¦¼ê¦©ê§€ê¦§ê¦ê¦¶, translit. Yogya Lagi Monument) commonly known as the Jogja Lagi Monument abbreviated as Monjali is a museum of the history of the Indonesian independence struggle in the Special Region of Yogyakarta and managed by the Ministry of Tourism and Creative Economy. This museum, which is located in the northern part of the city, is often visited by students on field trips.\n\nThis cone-shaped monument museum consists of 3 floors and is equipped with a library and multipurpose room. On the shutter at the entrance are written the names of 422 heroes who died in the Wehrkreise III (RIS) area between 19 December 1948 and 29 June 1949. In the 4 museum rooms on the 1st floor there are collection objects: reliefs, replicas, photos, documents, heraldry, various types of weapons, evocative forms of public kitchens in the atmosphere of the 1945-1949 war of independence. The palanquin and dokar (horse-drawn carriage) once used by Commander-in-Chief General Soedirman are also kept here (in museum room number 2). Yogya Lagi Monument is located at Jl. North Ring Road, Sleman Regency, Special Region of Yogyakarta.",Culture,Yogyakarta,15000,45,30.0,"{'lat': -7.7495904, 'lng': 110.3696068}",-77495904,1103696068,97,22,0
Taman Budaya Yogyakarta,"Yogyakarta Cultural Park (TBY) (Hanacaraka:ê¦ ê¦©ê¦¤ê§€â€‹ê¦§ê¦¸ê¦¢ê¦ªâ€‹ê¦”ê¦ªê¦ºê¦´ê¦' ê¦¾ê¦ ê¦‚ê¦ , Javanese: Ngayogyakarta Cultural Park) is a tourist facility located on Jalan Sri Wedani No 1, Yogyakarta. TBY has a building complex that functions as a venue for exhibitions, performances and various other arts activities. TBY is the Service Technical Implementation Unit (UPTD) at the Yogyakarta Special Region Provincial Culture Service. The function of TBY is as a cultural center including the development and processing of documentation centers, display cases and information on arts and culture and tourism._x000D_",Culture,Yogyakarta,0,45,210.0,"{'lat': -7.8001041, 'lng': 110.3676579}",-78001041,1103676579,100,20,0
Monumen Batik Yogyakarta,"The government's attention to batik culture is very large, this is because the culture is in direct contact with Javanese society. Commemorating National Batik Day today, travelers can take a walk to the batik monument in Jogja. The government's attention to batik culture is very large, this is because the culture is in direct contact with Javanese society. Commemorating National Batik Day today, travelers can take a walk to the batik monument in Jogja.",Culture,Yogyakarta,40000,45,15.0,"{'lat': -7.8011159, 'lng': 110.3646172}",-78011159,1103646172,102,24,0
Candi Donotirto,"Even though it is attached to the word temple, Donotirto Temple is not a relic of the Hindu-Buddhist era in Yogyakarta. This place was built by the Dutch government. There are two parts, namely the western part for men and the eastern part for women. Each of them is fed by 5 water fountains that originate from the Winogo River, meaning there are 10 fountains there. Until now, this place is still maintained by local residents even though it is used as a public toilet. Therefore, don't be reluctant to set aside your money to cover the costs of maintaining and cleaning this place.",Culture,Yogyakarta,0,44,25.0,"{'lat': -7.795561299999998, 'lng': 110.3612095}",-77955613,1103612095,105,19,0
