Place_Name,Description,Categories,City,Price,Ratings,Time_Minutes,Coordinate,Lat,Long,_1,Rating_Count,Categories_Label
Kyotoku Floating Market,"Kyotoku Floating Market Bandung, a contemporary tourist attraction with a Japanese theme. In this place you will see typical Japanese buildings and views like those of cherry blossoms. Japan is one of the countries besides South Korea which is a favorite destination for tourists from Indonesia. Because it is a developed country, visiting Japan requires quite a lot of accommodation costs, plane tickets, and a complicated visa process. No need to go far abroad, you can enjoy traveling with a Japanese feel in Bandung. Tourist managers designed this place to be similar to Kyoto, a region in Japan that is rich in culture. You don't need to wait for April to see cherry blossoms, which are a Japanese icon, this tourist area is equipped with cherry blossom decorations so that the Japanese atmosphere feels even stronger. For those of you who are interested in taking photos wearing a kimono or yukata with a Japanese-style background, you can post them on Instagram. The following is a brief review of this tourist area.",Culture,Bandung,175000,45,150.0,"{'lat': -6.819874999999999, 'lng': 107.618707}",-6819875,107618707,331,31,0
Rainbow Garden,"Rainbow Garden Harapan Indah is a recreational park that is especially suitable for families. With the concept of 'eat and play', Rainbow Garden Bekasi combines a children's play area with culinary tourism. Various rides and activities are available in this colorful tourist park covering an area of 3000 m2.",Nature preserve,Bandung,20000,46,90.0,"{'lat': -6.8179514, 'lng': 107.618914}",-68179514,107618914,332,23,1
Wisata Mangrove Tapak,"Semarang mangrove forest tourism is almost never empty of tourists. It is not uncommon for visitors to come to this beautiful tourist attraction to take selfies or just walk along the wooden walkways. This object is also instagrammable and suitable for sharing on social media, and is even sought after by those in the field of photography.",Nature preserve,Semarang,5000,43,90.0,"{'lat': -6.968561800000001, 'lng': 110.3459696}",-69685618,1103459696,349,18,1
Pantai Cipta,"Cipta Beach is also known as Petikemas Beach, because of its distance and close location to Petikemas Beach. Tourist attractions in Semarang, Cipta Beach only has a small stretch of sand and is dominated by rocks. Cipta Beach is a favorite tourist destination for Semarang residents because it is unique in terms of views and the surrounding environment. Taking selfies is the main activity on the beach because there are many interesting spots that can be immortalized. On weekends or long holidays, tourists often flock to Cipta Beach to just see the beach view. However, Cipta Beach has calm waves, so it is safe to use for swimming. On Cipta Beach itself there are lots of weeds which add to the beautiful scenery and make it a paradise for selfie hunters. The presence of weeds is what attracts visitors to come to Cipta beach just to take selfies._x000D_",Nautical,Semarang,5000,4,90.0,"{'lat': -6.9486402, 'lng': 110.4102923}",-69486402,1104102923,350,18,2
Semarang Contemporary Art Gallery,"You can find one of the art-related attractions in Semarang in the Kota Lama area, namely the Semarang Contemporary Art Gallery or more easily referred to as Galsem which means Semarang Gallery. Semarang Gallery is a well-known art museum and is still very popular among tourists, especially art lovers. The works of art on display here are the results of the cool hands of skilled artists from all over the archipelago.",Culture,Semarang,10000,46,90.0,"{'lat': -6.967499999999999, 'lng': 110.4282}",-69675,1104282,354,19,0
Wisata Alam Wana Wisata Penggaron,"Located around 2 KM from Ungaran City or around 18 KM from Semarang City, the Wana Wisata Penggaron Area is administratively located in Susukan Village, Ungaran District, Semarang Regency. This area is one of the forests under the guidance of the Independent Business Unit for Tourism, Seeds and Other Businesses (KBM WBU I) Perum Perhutani Unit I Central Java. Wana Wisata Penggaron or Wana Wisata Penggaron Nature Tourism is a forest tourist spot that you can use for a holiday with your family, one of which is for camping. This place is often used as a place for camping or vacationing by the people of Semarang. Wana Wisata Penggaron is an exotic forest, unfortunately this paradise in the city of Semarang is rarely touched by the eye. For visitors who ask the counter guard, with a simple and matter-of-fact answer ""an ordinary forest that is often used for camping, nothing special"", will of course feel disappointed.",Nature preserve,Semarang,10000,41,45.0,"{'lat': -7.115796899999999, 'lng': 110.4217966}",-71157969,1104217966,357,23,1
Taman Bunga Celosia,"Semarang tourism offers various interesting tourist attractions. One of them is visiting the Bandungan Celosia Flower Park. The location is at the foot of Mount Ungaran, Semarang. Offering natural surrounding views with panoramic views of the Ungaran mountains is the main attraction of this recreation park. Once you arrive here, the large parking area immediately welcomes you and don't miss the welcome gate. Along the way to the ticket counter, there is a fence in the shape of a giant colorful pencil. In addition, around the fence there are colorful flowers that decorate the path to the entrance counter.",Nature preserve,Semarang,25000,43,90.0,"{'lat': -7.225504099999998, 'lng': 110.3463166}",-72255041,1103463166,359,20,1
Monumen Palagan Ambarawa,"The Palagan Ambarawa Monument is a monument located in Ambarawa, Semarang Regency.\nThis monument is a symbol to commemorate the history of the battle of Palagan Ambarawa on 12 December - 15 December 1945 in Ambarawa. The Allied troops who were pressed from Magelang withdrew to Ambarawa, and the TKR troops led by Colonel Soedirman succeeded in destroying the Allies on December 15 1945, which is now celebrated as Infantry Day. The Palagan Ambarawa Monument was built in 1973 and inaugurated on December 15 1974 by the President Suharto. A brief overview of the history of the battle can be seen in the reliefs made on the walls of the Palagan Ambarawa Monument.\nIn this monument you can find relics of Japanese and Dutch rule. You can see uniforms of Japanese and Dutch soldiers, war weapons, Indonesian army uniforms, and other historical items. For a rather large size, you can find several ancient tanks, personnel carriers and cannons used in the battle. The most interesting thing is that you can find a Dutch Mustang plane that was shot down into Rawa Pening_x000D_",Culture,Semarang,7500,44,20.0,"{'lat': -7.259886099999998, 'lng': 110.4025602}",-72598861,1104025602,369,30,0
Benteng Pendem,"Pendem Fort Cilacap (Dutch: Kustbatterij op de Landtong te Cilacap), is a Dutch heritage fort on the coast of Teluk Penyu, Cilacap district, Central Java which was built in 1861. This building is a former Dutch East Indies army defense headquarters which was built in an area of 6 .5 hectares in stages over 18 years, from 1861 to 1879. Pendem Fort was covered by coastal land and neglected. This fort was later discovered and began to be excavated by the Cilacap government in 1986. Currently, the Cilacap Regency government has made this fort a historical tourist attraction_x000D_",Culture,Semarang,5000,42,60.0,"{'lat': -7.2706462, 'lng': 110.4103291}",-72706462,1104103291,370,16,0
Wisata Eling Bening,"tourist facility that is managed in a modern way, to create the pleasure of traveling as desired by young people. But still integrated with the environment, with natural beauty. Without doing any damage to nature. This tourist facility is the Eling Bening tourist attraction in the Ngrawan hills. Eling Bening is actually a restaurant that carries the concept of family tourism. Eling Bening offers very beautiful natural views with the main view of Rawa Pening. This beauty is further enhanced by the background of Mount Merbabu, Andong and Telomoyo, which can be seen standing proudly._x000D_",Nature preserve,Semarang,25000,43,90.0,"{'lat': -7.253109599999999, 'lng': 110.4264512}",-72531096,1104264512,371,25,1
Museum Kereta Ambarawa,"The Ambarawa Railway Museum (English: Indonesian Railway Museum, Ambarawa) is a train station that has been converted into a museum and is the first railway museum in Indonesia. This museum has a collection of trains that were once successful in their time. This museum is administratively located in Panjang Village, Ambarawa, Semarang. The museum, which is located at an altitude of +474.40 meters, is included in Semarang Operational Area IV and is managed by the Central Unit for Preservation and Architectural Design of PT Kereta Api Indonesia in collaboration with the Central Java Provincial Government.",Culture,Semarang,10000,45,60.0,"{'lat': -7.264598899999997, 'lng': 110.4046017}",-72645989,1104046017,373,27,0
Kota Lama Semarang,"The Old City of Semarang (Javanese: ê¦ ê¦¸ê¦›â€‹ê¦ê¦©â€‹ê¦±ê¦¼ê¦©ê¦«ê¦ , translit. Kutha Lama Semarang) is an area in Semarang became a trade center in the 19-20 century. At that time, to protect the residents and territory, a fort was built in the area, which was named Vijhoek fort. To speed up the communication routes between the three gates in the fort, communication roads were created, with the main road being named: Heeren Straat. Currently called Jl. Lt Jen Soeprapto. One of the locations of the fortress doors that exists today is the Berok Bridge, which is called De Zuider Por.\nThe Old City area of Semarang is also called Outstadt. The area of this area is around 31 hectares. Judging from the geographical conditions, it appears that this area is separated from the surrounding area, so it looks like a separate city with the nickname ""Little Netherland"". The Old City area of Semarang is a silent witness to the history of Indonesia during the Dutch colonial period for more than 2 centuries, and its location is adjacent to the economic area. In this place there are around 50 ancient buildings that still stand firmly and have a history of Colonialism in Semarang. In general, the character of the buildings in this region follows those on the European continent around the 1700s. This can be seen from the distinctive building details and ornaments that are identical to European style. Such as the extraordinarily large size of the doors and windows, the use of colored glass, the unique shape of the roof, and the existence of an underground room. Like other cities under Dutch colonial rule, a fort was also built as a military center. This fort is pentagon-shaped and was first built on the west side of the old city of Semarang today. This fort has only one gate on its south side and five watchtowers. Each tower is named: Zeeland, Amsterdam, Utrecht, Raamsdonk and Bunschoten. The Dutch government moved the Chinese settlement in 1731 near the Dutch settlement, to make it easier to monitor all Chinese activities. Therefore, the Fort is not only a military center, but also a watchtower for all Chinese activities.\nThe Old City has become one of the favorite icons for the residents of Semarang City and even foreign countries also come to this Old City. It is planned that the Old City of Semarang will be submitted as a UNESCO World Heritage Site.",Culture,Semarang,0,47,90.0,"{'lat': -6.9681399, 'lng': 110.4278611}",-69681399,1104278611,375,21,0
Semarang Chinatown,"The formation of Semarang Chinatown was inseparable from the Chinatown commotion in Batavia (former Jakarta) in 1740. At that time the Chinese people rebelled against the Dutch authorities. In the aftermath of this tragedy, many residents of Chinese descent fled along the north coast of Java until finally arriving in Semarang. Until 1743, the rebellion continued until finally it was completely stopped by the Dutch army. The colonial government then decided to gather Chinese citizens in one location. After briefly occupying the Simongan area near the Sam Poo Kong Temple, they were then moved to the Semarang River until it became known as the Chinatown area to this day.",Culture,Semarang,30000,45,30.0,"{'lat': -6.974992299999999, 'lng': 110.424954}",-69749923,110424954,376,21,0
Kampung Tematik Jawi,"It cannot be denied that Kampung Jawi Gunungpati Semarang has gone viral and is even visited by many people. Even though this culinary tourism started in a small village, now it has been visited by many local residents and those from outside the city. Fame is now also often seen on social media. When visiting Jawi Gunungpati Village you can feel the rural atmosphere of the past. Apart from that, the feel of the night is also peaceful and dark plus the lighting is dim, because they use Sentir lamps (oil lamps). So it's really fun to hang out for a long time.",Culture,Semarang,0,45,90.0,"{'lat': -7.029097399999999, 'lng': 110.3775382}",-70290974,1103775382,384,19,0
Kampung Batik Gedong Semarang,"Semarang Batik Village is one of the unique and interesting villages in Semarang City which has always been associated with Semarang batik from ancient times until now. Semarang Batik Village is located around the Bubagan area of Semarang. Semarang Batik Village in history from the 1970s to the 1980s, at that time it was completely dead and there were no batik activities. Only then in 2005 did activities begin, this took place because there was an opinion ""why is it called Kampung Batik Semarang"". However, how come there are no people making batik, so activities such as batik training are often encouraged, this aims to facilitate and revitalize the Semarang Batik Village. At that time it was famous for Krajan Batik, Gedong Batik, Central Batik, Malang Batik, Kubur Sari Batik and Kandang Wedus Batik which were famous for their own motifs. However, unfortunately this motif was not recorded visually, and this is actually a treasure that has not been discovered until now visually in these batik motifs.",Culture,Semarang,0,44,45.0,"{'lat': -6.968882100000001, 'lng': 110.4318692}",-69688821,1104318692,385,21,0
Obyek Wisata Goa Kreo,"Kreo Semarang Cave, which is in the capital of Central Java, is a hit among netizens. It's not surprising that if the weather is sunny, the queue to get there is so snaking. Even though there is no public transportation to get there, it doesn't hinder tourists' curiosity. This cave was formed naturally. What differentiates this cave from other caves is its location. The location is in the middle of the Jatibarang reservoir, a dam that blocks the Kreo River.",Nature preserve,Semarang,5500,43,60.0,"{'lat': -7.0372113, 'lng': 110.3476164}",-70372113,1103476164,387,18,1
Brown Canyon,"In Indonesia, Brown Canyon is a former mining area in Meteseh, Tembalang, Semarang. This location is one of the popular locations (not tourist attractions) in Semarang and is considered similar to the Grand Canyon in the United States. This similarity lies in the hills that turn into steep cliffs.",Nature preserve,Semarang,0,42,30.0,"{'lat': -7.0565164, 'lng': 110.4862531}",-70565164,1104862531,389,21,1
Durian Gardens and Tourism Education Watu Simbar,"Please note, Watu Simbar is a tourist location that offers education about various types of durian trees. Even though it seems ordinary, this is what actually makes this place unique. If someone comes here, that person will be able to learn many things about durian trees. Apart from being able to learn various things about the durian tree, of course visitors can also buy durian there.",Nature preserve,Semarang,5000,41,45.0,"{'lat': -7.096707899999999, 'lng': 110.3900517}",-70967079,1103900517,390,13,1
Flower Farm Setiya Aji,"In the Setiya Aji Flower Farm flower garden we can see colorful chrysanthemums which look very beautiful. Apart from that, its location in the highlands makes the air in the Bandungan flower garden feel quite fresh. The Setiya Aji Flower Farm Bandungan flower garden immediately attracted the attention of tourists, especially young people who were curious to see the beauty of the flowers in this Semarang tourist spot. Now Setiya Aji Flower Farm has become one of the favorite tourist attractions in Bandungan that must be visited, especially for tourists who are looking for a romantic tourist attraction in Semarang Regency other than Gedong Songo.",Nature preserve,Semarang,7500,41,45.0,"{'lat': -7.2241813, 'lng': 110.3782661}",-72241813,1103782661,391,23,1
Ekowisata Mangrove Wonorejo,"Surabaya Mangrove Tourism Forest is a tourist attraction that combines recreational and educational tourism. In an area of approximately 200 hectares, various mangrove plants are planted. This tourist location is well managed by the Surabaya City government. So this tourist attraction attracts visitors because it is neat and clean. Tourist activities that can be done include touring the mangrove forest either by boat or on foot. As well as educational tours about the surrounding ecosystem._x000D_",Nature preserve,Surabaya,0,43,60.0,"{'lat': -7.308648199999999, 'lng': 112.8216622}",-73086482,1128216622,392,16,1
Taman Harmoni Keputih,"This place is Hatmoni Keputih Park, Surabaya, which has a vast collection of colorful flowers. Previously, this place was a rubbish dump or landfill location, but now it has been transformed into a very beautiful tourist park. Not only are they beautiful, but the flowers that bloom in Taman Harmoni look very instagrammable, so it's not surprising that the majority of visitors to this place are young people who are social media activists. So what is the budget to enter the Taman Harmoni Surabaya area? You don't need to worry, because the entrance ticket to Taman Harmoni Keputih Surabaya is free. You only need to prepare your pocket to pay for the parking ticket.",Nature preserve,Surabaya,0,44,60.0,"{'lat': -7.2952211, 'lng': 112.8035603}",-72952211,1128035603,393,18,1
Monumen Kapal Selam,"The Submarine Monument, or Monkasel for short, is a submarine museum located in Embong Kaliasin, Genteng, Surabaya. Located in the city center, this monument is actually the KRI Pasopati 410 submarine, one of the Republic of Indonesia Navy fleet made by the Soviet Union in 1952. This submarine was involved in the Battle of the Aru Sea to liberate West Irian from Dutch occupation.\nThis submarine was later brought to land and made into a monument to commemorate the bravery of Indonesian heroes. Monkasel is on Jalan Pemuda, right next to Plaza Surabaya. Apart from the interior of the submarine, a film screening about the war process that took place in the Aru Sea was also held here. If you want to visit this tourist spot, you will be accompanied by a local guide there.\nThere is a unique story behind the presence of this Submarine Monument. One night Mr. Drajat Budiyanto, who was a former KKM KRI Pasopati 410 (made in Russia) and also a former KKM KRI Cakra 401 (made in West Germany), dreamed that he was ordered by the KSAL at that time to take this submarine to Kali Mas. It turns out that dream came true. He was assigned to display the submarine next to Surabaya Plaza. The method is to cut the submarine into several parts, then transport it to land, and assemble and reconnect it into a complete submarine.",Culture,Surabaya,15000,44,30.0,"{'lat': -7.2654304, 'lng': 112.7503052}",-72654304,1127503052,396,19,0
Hutan Bambu Keputih,"Surabaya is the second metropolitan city after Jakarta. Surabaya's population density is quite high, and because it is located on the coast, the city temperature feels hot. Even so, there are still cool, shady and beautiful places in the middle of Surabaya City. It is the Surabaya Bamboo Forest, precisely located in Keputih. When you hear the name ""Bamboo Forest"", perhaps what comes to mind is a forest in the countryside. But make no mistake, even in the middle of the city you can find a beautiful place like this. The beautiful atmosphere makes visitors flock to this location. And now, this recreation park is becoming a favorite among visitors to spend their free time.",Nature preserve,Surabaya,0,43,25.0,"{'lat': -7.294190899999999, 'lng': 112.8017238}",-72941909,1128017238,400,23,1
Food Junction Grand Pakuwon,"Grand Pakuwon Food Junction is actually a food court with a slightly different concept from other places. The place is located in the Tandes area, West Surabaya (strategic with a romantic and unique atmosphere) where from the city center it only takes 20 minutes to get to the location. So it is not surprising that many Surabaya residents spend the afternoon in this place.",Shopping center,Surabaya,0,45,120.0,"{'lat': -7.251022000000003, 'lng': 112.6620053}",-7251022,1126620053,402,30,3
Kebun Bibit Wonorejo,"Even though it is called a nursery, this area is more suitable to be called a garden. The Wonorejo Nursery Area is divided into 2 parts, namely the Active Park and the Passive Park, both of which have a total area of 5.9 hectares. Hot weather that makes you stifling is best cooled down by visiting a cool place. Apart from malls, city parks in Surabaya such as the Wonorejo Nursery are also the right choice. Visitors will be pampered with cool air. This is because there are many towering trees.",Nature preserve,Surabaya,0,44,30.0,"{'lat': -7.312365499999999, 'lng': 112.7889021}",-73123655,1127889021,406,25,1
Kebun Binatang Surabaya,"Surabaya Zoo (KBS) (Arekan dialect: Suroboyo Zoo) is one of the popular zoos in Indonesia and is located in Surabaya. KBS is the most comprehensive zoo in Southeast Asia, containing more than 981 different animal species consisting of more than 2,806 animals. This includes rare Indonesian and world animals consisting of Mammals, Aves, Reptiles and Pisces._x000D_",Nature preserve,Surabaya,15000,43,180.0,"{'lat': -7.295954599999999, 'lng': 112.7366094}",-72959546,1127366094,408,22,1
Rumah Batik,"In this batik house there are around 2000 pieces of batik which have various patterns. These various batiks are made from various types of materials, namely prima, primis, santio, silk, prishmina and sarimpit. You can find not only batik cloth at this batik house, but also batik sarongs, batik clothes, batik trousers, batik skirts, batik shawls, and so on. For those of you who want to immediately visit this batik house in Surabaya, here is the address information for the batik house itself. So the batik house was originally located on Jalan Tambak, Dukuh 1, No. 4, RT. 01, RW. 09, Kapari sub-district, Genteng sub-district, Surabaya. In this place you will see various kinds of batik on display, namely batik from Surabaya, Bangkalan, Sidoarjo, Sumenep, Mojokerto, Ponorogo, Tuban, Jombang and Bojonegoro. Because the collection held at this Surabaya batik house is very diverse, of course many visitors want to come to this location. After that, this batik house was moved to Jalan Margorejo, no. 143, Surabaya._x000D_",Culture,Surabaya,0,45,15.0,"{'lat': -7.278735999999999, 'lng': 112.718453}",-7278736,112718453,409,15,0
Jembatan Merah,"The Red Bridge is a historical monument in Surabaya, East Java which was left as it is: as a bridge. The bridge, which is one of the titles of the song written by Gesang, was considered important during the VOC era because it was the most vital means of communication across Kalimas to the Surabaya Residency Building, which no longer has a trace.\nThe Red Bridge area is a commercial area that began to develop as a result of the Agreement. Paku Buwono II from Mataram with the VOC on 11 November 1743. In this agreement, part of the northern coastal area, including Surabaya, was handed over to the VOC. Since then, Surabaya has been completely under Dutch rule. Today, its position as a business center continues. Around the bridge there are economic indicators, including one of them is the Red Bridge Plaza.\nThe physical changes occurred around the 1890s, when the fence dividing it from the river was changed from wood to iron. Now the condition of the bridge that connects Jalan Rajawali and Jalan Kembang Jepun on the north side of Surabaya is almost exactly the same as other bridges. The only difference is the color red.",Culture,Surabaya,0,45,30.0,"{'lat': -7.2367447, 'lng': 112.7383009}",-72367447,1127383009,414,21,0
Museum De Javasche Bank,"The Bank Indonesia Museum (Indonesian: Museum Bank Indonesia) is a bank museum located in Surabaya, Indonesia. Officially established by Bank Indonesia and opened on January 27 2012 after restoration. This museum occupies a building that was formerly known as De Javasche Bank, the central bank of the Dutch East Indies. After Indonesian Independence, this building continued to function as a Bank Indonesia branch office in Surabaya until 1973. The museum is closed on Mondays and national holidays. There is no entry fee.",Culture,Surabaya,5000,46,60.0,"{'lat': -7.2353939, 'lng': 112.7367646}",-72353939,1127367646,415,17,0
